{
  "schema": "hearthline-plays.arc2-ignition-grant.v1",
  "grant_id": "TEMPLATE_REPLACE_WITH_UNIQUE_PUBLIC_EVAL_GRANT_ID",
  "scope": "PUBLIC_EVAL_ONCE",
  "competition_slug": "arc-prize-2026-arc-agi-2",
  "branch_commit": "0000000000000000000000000000000000000000",
  "branch_tree": "0000000000000000000000000000000000000000",
  "source_lock_sha256": "0000000000000000000000000000000000000000000000000000000000000000",
  "notebook_sha256": "0000000000000000000000000000000000000000000000000000000000000000",
  "solver_code_sha256": "0000000000000000000000000000000000000000000000000000000000000000",
  "config_sha256": "0000000000000000000000000000000000000000000000000000000000000000",
  "input_manifest_sha256": "0000000000000000000000000000000000000000000000000000000000000000",
  "run_manifest_sha256": "0000000000000000000000000000000000000000000000000000000000000000",
  "submission_sha256": "0000000000000000000000000000000000000000000000000000000000000000",
  "solution_semantic_sha256": "e623ea77ee8993928c50c4a5a51d3ed8c75c30e9bb65dcd480140d89f6fa5f9f",
  "hardware_class": "TEMPLATE_REPLACE_WITH_HARDWARE_CLASS",
  "max_runtime_seconds": 39600,
  "issued_at": "2000-01-01T00:00:00Z",
  "expires_at": "2000-01-01T00:00:01Z",
  "nonce": "0000000000000000000000000000000000000000000000000000000000000000",
  "human_approver": "TEMPLATE_REPLACE_WITH_HUMAN_APPROVER",
  "acknowledgement": "I authorize exactly one sealed public-evaluation audit; its aggregate result will not be used for tuning."
}
