{
  "schema": "hearthline-plays.arc2-ignition-grant.v1",
  "grant_id": "TEMPLATE_REPLACE_WITH_UNIQUE_KAGGLE_SUBMIT_GRANT_ID",
  "scope": "KAGGLE_SUBMIT_ONCE",
  "competition_slug": "arc-prize-2026-arc-agi-2",
  "branch_commit": "0000000000000000000000000000000000000000",
  "branch_tree": "0000000000000000000000000000000000000000",
  "source_lock_sha256": "0000000000000000000000000000000000000000000000000000000000000000",
  "notebook_sha256": "0000000000000000000000000000000000000000000000000000000000000000",
  "notebook_metadata_sha256": "0000000000000000000000000000000000000000000000000000000000000000",
  "solver_code_sha256": "0000000000000000000000000000000000000000000000000000000000000000",
  "config_sha256": "0000000000000000000000000000000000000000000000000000000000000000",
  "input_manifest_sha256": "0000000000000000000000000000000000000000000000000000000000000000",
  "hardware_class": "TEMPLATE_REPLACE_WITH_REVIEWED_HARDWARE_CLASS",
  "max_runtime_seconds": 39600,
  "issued_at": "2000-01-01T00:00:00Z",
  "expires_at": "2000-01-01T00:00:01Z",
  "nonce": "0000000000000000000000000000000000000000000000000000000000000000",
  "human_approver": "TEMPLATE_REPLACE_WITH_HUMAN_APPROVER",
  "acknowledgement": "I authorize exactly one submission of this notebook version and output; no later version or retry is covered.",
  "rules_sha256": "0000000000000000000000000000000000000000000000000000000000000000",
  "kaggle_notebook_version_id": "TEMPLATE_REPLACE_WITH_IMMUTABLE_NOTEBOOK_VERSION_ID",
  "output_sha256": "0000000000000000000000000000000000000000000000000000000000000000"
}
